{
  "formatVersion": 1,
  "catalogVersion": 1,
  "moduleId": "delay",
  "language": "ko-KR",
  "domains": {
    "nativefx.delay": {
      "module.name": "딜레이",
      "module.description": "8채널 네이티브 딜레이 화면.",
      "control.targetChannels": "대상 채널",
      "control.all": "전체",
      "label.preset": "프리셋:",
      "preset.default": "기본값",
      "preset.custom": "사용자 정의",
      "filter.highPass": "하이패스",
      "filter.lowPass": "로우패스",
      "window.title": "딜레이 — %1",
      "preset.vocalEcho": "보컬 에코",
      "preset.shortSlap": "짧은 슬랩",
      "preset.rhythmicEcho": "리드미컬 에코",
      "preset.ambientEcho": "앰비언트 에코",
      "preset.tapeEcho": "테이프 에코",
      "view.timeline": "타임라인",
      "view.echoDecay": "에코 감쇠",
      "mode.normal": "일반",
      "mode.additive": "가산",
      "description.delay": "에코와 공간감 생성",
      "control.timeMode": "시간 모드:",
      "mode.sync": "동기화",
      "mode.freeTime": "자유",
      "control.noteValue": "음표 값:",
      "control.dottedNote": "점음표",
      "control.view": "보기:",
      "control.delayTimeBpm": "딜레이 시간 · %1 BPM",
      "control.delayTime": "딜레이 시간",
      "control.feedback": "피드백",
      "control.wet": "웻",
      "control.dry": "드라이",
      "section.filters": "필터:",
      "control.mixMode": "믹스 모드:",
      "action.resetCurrent": "현재 채널 초기화",
      "action.resetAll": "모든 채널 초기화",
      "hint.feedback": "(Feedback)",
      "hint.wet": "(Wet)",
      "hint.dry": "(Dry)"
    }
  }
}
