{
  "formatVersion": 1,
  "catalogVersion": 1,
  "moduleId": "winjacknexus-classic-mixer",
  "language": "ko-KR",
  "domains": {
    "classicMixer": {
      "name": "클래식 믹서",
      "preset.name": "프리셋 이름",
      "preset.apply": "적용",
      "preset.save": "저장",
      "preset.new": "다른 이름으로 저장",
      "preset.delete": "삭제",
      "preset.none": "프리셋 없음",
      "error.presetName": "유효한 프리셋 이름을 입력하세요.",
      "error.apply": "믹서 설정을 적용할 수 없습니다.",
      "layout.label": "구성",
      "layout.choose": "믹서 구성 선택",
      "layout.description": "입력 오디오 채널 수 (Master와 Monitor는 별도)",
      "meter.input": "입력",
      "meter.post": "페이더 후",
      "channel.name": "채널 이름",
      "master": "마스터",
      "monitor": "모니터",
      "gain": "게인",
      "eq.enabled": "EQ",
      "eq.low": "저역",
      "eq.mid": "중역",
      "eq.high": "고역",
      "eq.frequency": "중역 주파수",
      "aux.1": "AUX 1",
      "aux.2": "AUX 2",
      "aux.post": "후",
      "aux.pre": "전",
      "pan": "팬",
      "mix": "MIX",
      "afl": "AFL",
      "pfl": "PFL",
      "a1": "A1",
      "a2": "A2",
      "mute": "M",
      "solo": "S",
      "help.mix": "마스터로 전송",
      "help.afl": "Gain 후, EQ 및 페이더 전에 모니터링",
      "help.pfl": "Gain 전에 모니터링",
      "help.a1": "AUX 1 활성화",
      "help.a2": "AUX 2 활성화",
      "help.mute": "이 채널의 Master 및 AUX 전송 음소거",
      "help.solo": "Master 경로에서 이 채널 솔로",
      "help.masterMute": "마스터 출력 음소거",
      "fader": "페이더",
      "diagnostic.invalidLayout": "잘못된 구성",
      "diagnostic.stripCount": "잘못된 채널 스트립 수",
      "diagnostic.channelName": "잘못되거나 중복된 채널 이름",
      "diagnostic.portName": "중복된 오디오 포트 이름",
      "diagnostic.channelParameters": "잘못된 채널 매개변수",
      "diagnostic.auxSend": "잘못된 AUX 전송",
      "diagnostic.busParameters": "잘못된 버스 매개변수",
      "diagnostic.auxMaster": "잘못된 AUX 마스터",
      "diagnostic.presetLimit": "프리셋 수 제한 초과",
      "diagnostic.presetRecord": "잘못된 프리셋 기록",
      "diagnostic.selectedPreset": "선택한 프리셋이 없습니다",
      "diagnostic.schema": "지원하지 않는 상태 형식",
      "diagnostic.inputState": "잘못된 입력 상태 형식",
      "diagnostic.auxState": "잘못된 AUX 상태 형식",
      "diagnostic.auxValues": "잘못된 AUX 값 형식",
      "diagnostic.busState": "잘못된 버스 상태 형식",
      "diagnostic.presetLibrary": "잘못된 프리셋 목록 형식",
      "diagnostic.presetMalformed": "잘못된 프리셋 기록 형식",
      "diagnostic.base64": "잘못된 프리셋 Base64",
      "diagnostic.notFound": "프리셋을 찾을 수 없습니다",
      "diagnostic.payload": "잘못된 프리셋 내용",
      "diagnostic.layoutMismatch": "프리셋 구성이 일치하지 않습니다",
      "diagnostic.fixedLayout": "준비 후에는 구성을 변경할 수 없습니다",
      "diagnostic.busy": "매개변수 대기열이 사용 중입니다",
      "diagnostic.topology": "포트 구성이 변경되었습니다",
      "diagnostic.identity": "포트 ID가 변경되었습니다",
      "diagnostic.snapshot": "연결 상태 저장 실패",
      "diagnostic.rename": "포트 이름 변경 또는 재연결 실패",
      "diagnostic.rollback": "복원이 완료되지 않았습니다",
      "diagnostic.presetName": "유효한 프리셋 이름을 입력하세요.",
      "modelName": "클래식 믹서 @LAYOUT@"
    }
  }
}
