{
  "formatVersion": 1,
  "catalogVersion": 1,
  "moduleId": "delay",
  "language": "en-US",
  "domains": {
    "nativefx.delay": {
      "module.name": "Delay",
      "module.description": "Eight-channel native delay interface.",
      "control.targetChannels": "Channel",
      "control.all": "All",
      "label.preset": "Preset:",
      "preset.default": "Default",
      "preset.custom": "Custom",
      "filter.highPass": "High-pass",
      "filter.lowPass": "Low-pass",
      "window.title": "Delay — %1",
      "preset.vocalEcho": "Vocal Echo",
      "preset.shortSlap": "Short Slap",
      "preset.rhythmicEcho": "Rhythmic Echo",
      "preset.ambientEcho": "Ambient Echo",
      "preset.tapeEcho": "Tape Echo",
      "view.timeline": "Timeline",
      "view.echoDecay": "Echo decay",
      "mode.normal": "Normal",
      "mode.additive": "Additive",
      "description.delay": "Create echoes and a sense of space",
      "control.timeMode": "Time mode:",
      "mode.sync": "Sync",
      "mode.freeTime": "Free",
      "control.noteValue": "Note value:",
      "control.dottedNote": "Dotted",
      "control.view": "View:",
      "control.delayTimeBpm": "Delay time · %1 BPM",
      "control.delayTime": "Delay time",
      "control.feedback": "Feedback",
      "control.wet": "Wet",
      "control.dry": "Dry",
      "section.filters": "Filters:",
      "control.mixMode": "Mix mode:",
      "action.resetCurrent": "Reset current channel",
      "action.resetAll": "Reset all channels",
      "hint.feedback": "(Feedback)",
      "hint.wet": "(Wet)",
      "hint.dry": "(Dry)"
    }
  }
}
