{
  "formatVersion": 1,
  "catalogVersion": 1,
  "moduleId": "delay",
  "language": "zh-CN",
  "domains": {
    "nativefx.delay": {
      "module.name": "Delay 延迟",
      "module.description": "八声道原生延迟界面。",
      "control.targetChannels": "作用声道",
      "control.all": "全部",
      "label.preset": "预设:",
      "preset.default": "默认",
      "preset.custom": "自定义",
      "filter.highPass": "高通",
      "filter.lowPass": "低通",
      "window.title": "Delay 延迟 — %1",
      "preset.vocalEcho": "人声回声",
      "preset.shortSlap": "短 slap",
      "preset.rhythmicEcho": "节奏回声",
      "preset.ambientEcho": "氛围长回声",
      "preset.tapeEcho": "磁带回声",
      "view.timeline": "时间轴",
      "view.echoDecay": "回声衰减",
      "mode.normal": "正常",
      "mode.additive": "叠加",
      "description.delay": "创造回声与空间感",
      "control.timeMode": "时间模式:",
      "mode.sync": "同步",
      "mode.freeTime": "自由",
      "control.noteValue": "音符值:",
      "control.dottedNote": "点音符",
      "control.view": "视图:",
      "control.delayTimeBpm": "延迟时间 · %1 BPM",
      "control.delayTime": "延迟时间 (Time)",
      "control.feedback": "反馈",
      "control.wet": "湿信号",
      "control.dry": "干信号",
      "section.filters": "滤波器:",
      "control.mixMode": "混合模式:",
      "action.resetCurrent": "重置当前声道",
      "action.resetAll": "重置所有声道",
      "hint.feedback": "(Feedback)",
      "hint.wet": "(Wet)",
      "hint.dry": "(Dry)"
    }
  }
}
