{
  "formatVersion": 1,
  "moduleId": "module-winjacknexus-vst-host",
  "language": "ja-JP",
  "catalogVersion": 1,
  "domains": {
    "vst": {
      "error.shellEmpty": "VST2 Shell が内部プラグインを返しませんでした。",
      "choose.filter": "絞り込み、またはプラグイン名 / ID を入力",
      "error.factoryEmpty": "VST3 ファクトリーがオーディオプラグインクラスを返しませんでした。",
      "error.savePreset": "VST プリセットを保存できません。",
      "status.saved": "VST プリセットを保存しました。",
      "error.presetMissing": "選択した VST プリセットファイルが存在しません。",
      "error.loadPreset": "VST プリセットを読み込めません。",
      "status.loaded": "VST プリセットを読み込みました。",
      "choose.plugin": "VST プラグインを選択",
      "filter.plugin": "VST プラグイン (*.vst3 *.dll)",
      "status.editor": "プラグインエディターを別ウィンドウで開きました。",
      "error.contact": "VSTProcess に接続できません。",
      "status.choose": "VST プラグインを選択してサンドボックスを起動します。",
      "error.pathMissing": "設定されたプラグインパスが存在しません。",
      "error.processMissing": "必要な VSTProcess 実行ファイルがありません。",
      "error.vst3Name": "このモジュールに設定された VST3 プラグイン名がありません。",
      "status.chooseClass": "このノードを起動する前に VST3 プラグインクラスを選択してください。",
      "choose.vst3": "VST3 プラグインを選択",
      "choose.vst3Description": "VST3 プラグインクラスを選択するか、クラス ID を入力してください。",
      "status.vst3Cancelled": "VST3 プラグインクラスの選択をキャンセルしました。",
      "status.chooseShell": "このノードを起動する前に VST2 Shell 内部プラグインを選択してください。",
      "choose.shell": "VST2 Shell プラグインを選択",
      "choose.shellDescription": "内部プラグインを選択するか、名前 / 数値 ID を入力してください。",
      "status.shellCancelled": "VST2 Shell プラグインの選択をキャンセルしました。",
      "error.previousProcess": "前の VSTProcess がまだ実行中です。",
      "status.bypassStopped": "バイパス中の VSTProcess が停止しました（終了コード %1）。復旧するにはプラグインを再起動してください。",
      "status.crash": "VSTProcess がクラッシュしました（終了コード %1）。このノードをバイパスに切り替えます。",
      "error.start": "VSTProcess を起動できません。",
      "error.pipeTimeout": "VSTProcess の制御パイプが起動期限内に準備できませんでした。",
      "status.bypass": "プラグインのクラッシュ後、VSTProcess はプラグイン入出力をバイパスしています。",
      "status.running": "VSTProcess は実行中です。",
      "error.tempPreset": "一時 VST プリセットファイルを作成できません。",
      "error.writeState": "VST プリセットの状態を書き込めません。",
      "error.restoreState": "VST プリセットの状態を復元できません。",
      "status.terminate": "VSTProcess が正常に終了しなかったため、サンドボックスを終了します。",
      "status.notStarted": "未起動。",
      "port.default": "既定のプラグイン名",
      "port.bus": "バスとチャンネルのラベル",
      "port.standard": "標準チャンネル名",
      "port.jack": "JACK の既定名",
      "field.client": "クライアント名",
      "field.port": "ポート表示",
      "action.apply": "適用して再ロード",
      "action.load": "プリセットを読み込み",
      "action.save": "プリセットを別名で保存",
      "action.restart": "プラグインを再起動",
      "choose.preset": "VST プリセットを選択",
      "filter.preset": "WinJACKNexus VST プリセット (*.fbx)",
      "choose.save": "VST プリセットを保存",
      "action.browse": "参照",
      "process.auto": "自動",
      "process.64": "64 ビット",
      "process.32": "32 ビット",
      "field.plugin": "プラグイン",
      "field.preset": "プリセット",
      "field.process": "プロセス",
      "module.name": "VST プラグイン"
    }
  }
}
