{
  "formatVersion": 1,
  "moduleId": "vst-scanner",
  "language": "ko-KR",
  "catalogVersion": 1,
  "domains": {
    "vstscanner": {
      "title": "VST 스캐너",
      "scan": "플러그인 스캔",
      "rescan": "검증된 플러그인 다시 스캔",
      "incrementalHint": "기본적으로 새 플러그인 또는 미검증 플러그인만 스캔",
      "openOutput": "출력 폴더 열기",
      "locationHint": "플러그인을 두 번 클릭하면 위치가 열립니다",
      "ready": "준비됨",
      "paths": "스캔 경로",
      "add": "추가",
      "remove": "제거",
      "output": "출력 폴더",
      "chooseOutput": "출력 폴더 선택",
      "format": "형식",
      "all": "전체",
      "category": "분류",
      "effect": "이펙트",
      "instrument": "악기",
      "search": "이름, 제조사 또는 경로 검색",
      "name": "이름",
      "vendor": "제조사",
      "bits": "비트 수",
      "version": "버전",
      "openLocation": "플러그인 위치 열기",
      "removeEntry": "항목 삭제",
      "removeMissing": "누락된 항목 제거",
      "log": "스캔 로그",
      "pluginCount": "플러그인: %1",
      "choosePath": "VST 스캔 경로 선택",
      "deleteTitle": "플러그인 항목 삭제",
      "deleteQuestion": "선택한 스캔 항목을 삭제하시겠습니까?\n플러그인 파일은 유지됩니다.",
      "deleteFailed": "삭제 실패",
      "cannotDeleteInfo": "info 파일을 삭제할 수 없습니다.",
      "removedCount": "누락된 항목 %1개 제거",
      "errorPrefix": "[오류]",
      "infoPrefix": "[정보]",
      "starting": "스캔 시작...",
      "preparing": "스캔 준비...",
      "noCandidates": "플러그인 후보를 찾지 못했습니다",
      "complete": "스캔 완료",
      "scanning": "스캔 중: %1 (%2/%3)",
      "summary": "스캔 완료: %1개 항목 기록, 폴더 내 총 %2개 항목.",
      "noPlugins": "플러그인을 찾지 못했습니다",
      "written": "스캔 완료: %1개 항목 기록",
      "message.unsupportedBits": "지원하지 않는 플러그인 비트 수: %1",
      "message.probeMissing": "격리된 검사기를 찾지 못했습니다: ",
      "message.probeStart": "격리된 검사기를 시작할 수 없습니다: ",
      "message.probeTimeout": "플러그인 검사 시간 초과, 격리된 프로세스 종료",
      "message.probeCrash": "플러그인 검사 충돌, 스캐너는 계속 실행됨",
      "message.probeNoResult": "격리된 검사기 결과가 없습니다: ",
      "message.probeJson": "격리된 검사 결과가 유효한 JSON이 아닙니다",
      "message.probeFailed": "격리된 검사기가 실패를 보고했습니다",
      "message.probeNoClass": "격리된 검사기가 사용 가능한 플러그인 클래스를 반환하지 않았습니다",
      "message.moduleRead": "moduleinfo.json을 읽을 수 없습니다: ",
      "message.moduleParse": "moduleinfo.json을 파싱할 수 없습니다: ",
      "message.infoDirectory": "info 폴더를 만들 수 없습니다: ",
      "message.infoWrite": "info 파일을 쓸 수 없습니다: ",
      "message.infoCommit": "info 파일을 저장할 수 없습니다: ",
      "message.outputCreate": "출력 폴더를 만들 수 없습니다",
      "message.pathMissing": "스캔 경로가 존재하지 않습니다",
      "message.vst3Binary": "비트 수를 인식할 수 있는 VST3 바이너리를 찾지 못했습니다",
      "message.vst3Skipped": "검증된 VST3 건너뛰기, 기존 info 항목 사용",
      "message.vst3Loaded": "VST3를 격리하여 로드하고 클래스 정보를 가져왔습니다",
      "message.vst3Partial": "VST3 클래스 격리 검사, 일부 로드 실패, 항목 유지: ",
      "message.vst3ClassSkipped": "VST3 클래스가 이미 검증되어 검사 건너뛰기",
      "message.vst3Static": "격리 로드가 클래스를 반환하지 않아 정적 moduleinfo 데이터 유지: ",
      "message.vst2Skipped": "검증된 VST2 건너뛰기, 기존 info 항목 사용",
      "message.invalidDll": "유효하지 않은 VST DLL 건너뛰기",
      "probe.noComponent": "VST3 팩터리가 사용 가능한 컴포넌트 클래스를 반환하지 않았습니다",
      "probe.invalidClassId": "유효하지 않은 VST3 클래스 ID: %1",
      "probe.missingClassId": "VST3 팩터리에서 클래스 ID를 찾을 수 없습니다: %1",
      "probe.createComponent": "VST3 컴포넌트 클래스를 생성할 수 없습니다: %1",
      "probe.initializeComponent": "VST3 컴포넌트를 초기화할 수 없습니다: %1",
      "probe.loadLibrary": "LoadLibraryExW 실패",
      "probe.missingEntry": "VST2 모듈에 VSTPluginMain/main 진입점이 없습니다",
      "probe.invalidEffect": "VST2 모듈이 유효하지 않은 AEffect를 반환했습니다",
      "probe.vst2Disabled": "VST2 검사가 비활성화되었습니다",
      "probe.failed": "플러그인 검사 실패"
    }
  }
}
