{
  "formatVersion": 1,
  "catalogVersion": 1,
  "moduleId": "compressor",
  "language": "ja-JP",
  "domains": {
    "nativefx.compressor": {
      "module.name": "コンプレッサー",
      "module.description": "8 チャンネルのネイティブ・コンプレッサー操作画面。",
      "control.threshold": "しきい値",
      "control.ratio": "比率",
      "control.attack": "アタック",
      "control.release": "リリース",
      "control.targetChannels": "対象チャンネル",
      "control.all": "全て",
      "label.preset": "プリセット:",
      "preset.default": "デフォルト",
      "preset.custom": "カスタム",
      "axis.inputLevel": "入力レベル (dB)",
      "axis.outputLevel": "出力レベル (dB)",
      "control.sidechainFilter": "サイドチェーンフィルター",
      "filter.highPass": "ハイパス",
      "filter.lowPass": "ローパス",
      "action.restoreDefaults": "デフォルトに戻す",
      "window.title": "コンプレッサー — %1",
      "description.compressor": "ダイナミクスを制御してレベルを安定させる",
      "preset.punchyDrums": "パンチのあるドラム",
      "preset.gentleLevel": "穏やかなレベル調整",
      "control.softKnee": "ソフトニー",
      "control.makeupGain": "メイクアップゲイン",
      "control.detectorMode": "検出方式:",
      "meter.peak": "ピーク",
      "control.autoGain": "自動ゲイン"
    }
  }
}
