{
  "formatVersion": 1,
  "catalogVersion": 1,
  "moduleId": "reverb",
  "language": "ko-KR",
  "domains": {
    "nativefx.reverb": {
      "module.name": "리버브",
      "module.description": "8채널 네이티브 룸 리버브.",
      "control.targetChannels": "대상 채널",
      "control.all": "전체",
      "label.preset": "프리셋:",
      "preset.default": "기본값",
      "preset.custom": "사용자 정의",
      "window.title": "리버브 — %1",
      "description.reverb": "실제 공간을 재현하여 공간감 강화",
      "scene.room": "룸",
      "scene.hall": "홀",
      "scene.plate": "플레이트",
      "scene.church": "교회",
      "scene.studio": "스튜디오",
      "scene.spring": "스프링",
      "preset.smallRoom": "작은 방",
      "preset.brightPlate": "밝은 플레이트",
      "preset.cathedral": "대성당",
      "preset.studioBooth": "녹음 부스",
      "preset.vintageSpring": "빈티지 스프링",
      "control.reverbType": "리버브 유형:",
      "label.customRoomArea": "사용자 정의 · %1 m²",
      "control.decay": "잔향 시간",
      "control.roomSize": "공간 크기",
      "control.preDelay": "프리딜레이",
      "control.diffusion": "확산",
      "section.earlyReflections": "초기 반사",
      "section.highDamping": "고역 감쇠",
      "section.lowDamping": "저역 감쇠",
      "control.level": "레벨",
      "label.time": "시간",
      "control.cutoff": "차단 주파수",
      "control.attenuation": "감쇠",
      "control.mix": "믹스",
      "control.stereoWidth": "스테레오 폭:",
      "label.outputLevel": "출력 레벨:",
      "control.wet": "웻",
      "control.dry": "드라이",
      "hint.decay": "(Decay)",
      "hint.size": "(Size)",
      "hint.predelay": "(Pre-Delay)",
      "hint.diffusion": "(Diffusion)"
    }
  }
}
