{
  "formatVersion": 1,
  "catalogVersion": 1,
  "moduleId": "delay",
  "language": "ja-JP",
  "domains": {
    "nativefx.delay": {
      "module.name": "ディレイ",
      "module.description": "8 チャンネルのネイティブ・ディレイ画面。",
      "control.targetChannels": "対象チャンネル",
      "control.all": "全て",
      "label.preset": "プリセット:",
      "preset.default": "デフォルト",
      "preset.custom": "カスタム",
      "filter.highPass": "ハイパス",
      "filter.lowPass": "ローパス",
      "window.title": "ディレイ — %1",
      "preset.vocalEcho": "ボーカルエコー",
      "preset.shortSlap": "短いスラップ",
      "preset.rhythmicEcho": "リズミックエコー",
      "preset.ambientEcho": "アンビエントエコー",
      "preset.tapeEcho": "テープエコー",
      "view.timeline": "タイムライン",
      "view.echoDecay": "エコーの減衰",
      "mode.normal": "通常",
      "mode.additive": "加算",
      "description.delay": "エコーと空間の広がりを作る",
      "control.timeMode": "時間モード:",
      "mode.sync": "同期",
      "mode.freeTime": "フリー",
      "control.noteValue": "音価:",
      "control.dottedNote": "付点",
      "control.view": "表示:",
      "control.delayTimeBpm": "ディレイ時間 · %1 BPM",
      "control.delayTime": "ディレイ時間",
      "control.feedback": "フィードバック",
      "control.wet": "ウェット",
      "control.dry": "ドライ",
      "section.filters": "フィルター:",
      "control.mixMode": "ミックスモード:",
      "action.resetCurrent": "現在のチャンネルをリセット",
      "action.resetAll": "全チャンネルをリセット",
      "hint.feedback": "(Feedback)",
      "hint.wet": "(Wet)",
      "hint.dry": "(Dry)"
    }
  }
}
