{
  "formatVersion": 1,
  "catalogVersion": 1,
  "moduleId": "midi-tools-midi_matrix",
  "language": "en-US",
  "domains": {
    "midi.midi_matrix": {
      "name": "MIDI matrix",
      "description": "MIDI Tools node",
      "help": "Rows are input ports; columns are output ports. Original MIDI channels are preserved.",
      "input": "Input",
      "output": "Output"
    }
  }
}
