{
  "formatVersion": 1,
  "catalogVersion": 1,
  "moduleId": "reverb",
  "language": "zh-CN",
  "domains": {
    "nativefx.reverb": {
      "module.name": "Reverb 混响",
      "module.description": "八声道原生房间混响。",
      "control.targetChannels": "作用声道",
      "control.all": "全部",
      "label.preset": "预设:",
      "preset.default": "默认",
      "preset.custom": "自定义",
      "window.title": "Reverb 混响 — %1",
      "description.reverb": "模拟真实空间，增强声音的空间感",
      "scene.room": "房间",
      "scene.hall": "大厅",
      "scene.plate": "板式",
      "scene.church": "教堂",
      "scene.studio": "录音室",
      "scene.spring": "弹簧",
      "preset.smallRoom": "小房间",
      "preset.brightPlate": "明亮板式",
      "preset.cathedral": "大教堂",
      "preset.studioBooth": "录音隔间",
      "preset.vintageSpring": "复古弹簧",
      "control.reverbType": "混响类型:",
      "label.customRoomArea": "自定义 · %1 m²",
      "control.decay": "混响时间",
      "control.roomSize": "空间大小",
      "control.preDelay": "预延迟",
      "control.diffusion": "扩散",
      "section.earlyReflections": "早期反射",
      "section.highDamping": "高频阻尼",
      "section.lowDamping": "低频阻尼",
      "control.level": "电平",
      "label.time": "时间",
      "control.cutoff": "截止频率",
      "control.attenuation": "衰减",
      "control.mix": "混合",
      "control.stereoWidth": "立体声宽度:",
      "label.outputLevel": "输出电平:",
      "control.wet": "湿信号",
      "control.dry": "干信号",
      "hint.decay": "(Decay)",
      "hint.size": "(Size)",
      "hint.predelay": "(Pre-Delay)",
      "hint.diffusion": "(Diffusion)"
    }
  }
}
