{
  "formatVersion": 1,
  "moduleId": "vst-scanner",
  "language": "en-US",
  "catalogVersion": 1,
  "domains": {
    "vstscanner": {
      "title": "VST Scanner",
      "scan": "Scan plug-ins",
      "rescan": "Rescan verified plug-ins",
      "incrementalHint": "Only scan new or unverified plug-ins by default",
      "openOutput": "Open output directory",
      "locationHint": "Double-click a plug-in to open its location",
      "ready": "Ready",
      "paths": "Scan paths",
      "add": "Add",
      "remove": "Remove",
      "output": "Output directory",
      "chooseOutput": "Choose output directory",
      "format": "Format",
      "all": "All",
      "category": "Category",
      "effect": "Effect",
      "instrument": "Instrument",
      "search": "Search name, vendor or path",
      "name": "Name",
      "vendor": "Vendor",
      "bits": "Bit depth",
      "version": "Version",
      "openLocation": "Open plug-in location",
      "removeEntry": "Delete entry",
      "removeMissing": "Remove missing entries",
      "log": "Scan log",
      "pluginCount": "Plug-ins: %1",
      "choosePath": "Choose VST scan path",
      "deleteTitle": "Delete plug-in entry",
      "deleteQuestion": "Delete the selected scan entry?\nThe plug-in file will be kept.",
      "deleteFailed": "Deletion failed",
      "cannotDeleteInfo": "Cannot delete the info file.",
      "removedCount": "Removed missing entries: %1",
      "errorPrefix": "[Error]",
      "infoPrefix": "[Info]",
      "starting": "Starting scan...",
      "preparing": "Preparing scan...",
      "noCandidates": "No plug-in candidates found",
      "complete": "Scan complete",
      "scanning": "Scanning: %1 (%2/%3)",
      "summary": "Scan complete: %1 entries written, %2 entries in the directory.",
      "noPlugins": "No plug-ins found",
      "written": "Scan complete: %1 entries written",
      "message.unsupportedBits": "Unsupported plug-in bit depth: %1",
      "message.probeMissing": "Isolated probe not found: ",
      "message.probeStart": "Cannot start isolated probe: ",
      "message.probeTimeout": "Plug-in probe timed out; isolated process terminated",
      "message.probeCrash": "Plug-in probe crashed; scanner kept running",
      "message.probeNoResult": "Isolated probe produced no result: ",
      "message.probeJson": "Isolated probe result is not valid JSON",
      "message.probeFailed": "Isolated probe reported failure",
      "message.probeNoClass": "Isolated probe returned no usable plug-in classes",
      "message.moduleRead": "Cannot read moduleinfo.json: ",
      "message.moduleParse": "Cannot parse moduleinfo.json: ",
      "message.infoDirectory": "Cannot create info directory: ",
      "message.infoWrite": "Cannot write info file: ",
      "message.infoCommit": "Cannot commit info file: ",
      "message.outputCreate": "Cannot create output directory",
      "message.pathMissing": "Scan path does not exist",
      "message.vst3Binary": "No VST3 binary with a recognized bit depth found",
      "message.vst3Skipped": "Skipped verified VST3; using existing info entries",
      "message.vst3Loaded": "Loaded VST3 in isolation and obtained class information",
      "message.vst3Partial": "VST3 classes probed in isolation; some failed to load, entries kept: ",
      "message.vst3ClassSkipped": "VST3 classes already verified; skipping probe",
      "message.vst3Static": "Isolated load returned no classes; keeping static moduleinfo data: ",
      "message.vst2Skipped": "Skipped verified VST2; using existing info entries",
      "message.invalidDll": "Skipped invalid VST DLL",
      "probe.noComponent": "VST3 factory returned no usable component class",
      "probe.invalidClassId": "Invalid VST3 class ID: %1",
      "probe.missingClassId": "VST3 factory cannot find class ID: %1",
      "probe.createComponent": "Cannot create VST3 component class: %1",
      "probe.initializeComponent": "Cannot initialize VST3 component: %1",
      "probe.loadLibrary": "LoadLibraryExW failed",
      "probe.missingEntry": "VST2 module has no VSTPluginMain/main entry point",
      "probe.invalidEffect": "VST2 module returned an invalid AEffect",
      "probe.vst2Disabled": "VST2 probing is disabled",
      "probe.failed": "Plug-in probe failed"
    }
  }
}
